<?xml version="1.0" encoding="UTF-8"?>
<list xmlns:xsi="http://www.w3.org/2001/XMLSchema-instance" xsi:noNamespaceSchemaLocation="../../../xsd/npcs.xsd">
	<npc id="900101" displayId="31843" level="70" type="Teleporter" name="Teleportation Cubic">
		<parameters>
			<param name="MoveAroundSocial" value="0" />
			<param name="MoveAroundSocial1" value="0" />
		</parameters>
		<race>ETC</race>
		<sex>MALE</sex>
		<stats str="40" int="21" dex="30" wit="20" con="43" men="10">
			<vitals hp="2444.46819" hpRegen="7.5" mp="1345.8" mpRegen="2.7" />
			<attack physical="688.86373" magical="470.40463" random="30" critical="4" accuracy="5" attackSpeed="253" type="SWORD" range="40" distance="80" width="120" />
			<defence physical="295.91597" magical="216.53847" />
			<speed>
				<walk ground="50" />
				<run ground="120" />
			</speed>
		</stats>
		<status attackable="false" />
		<skillList>
			<skill id="4045" level="1" /> <!-- Resist Full Magic Attack -->
			<skill id="4416" level="19" /> <!-- Others -->
		</skillList>
		<exCrtEffect>true</exCrtEffect>
		<ai aggroRange="1000" clanHelpRange="300" isAggressive="false" />
		<collision>
			<radius normal="40" />
			<height normal="80" />
		</collision>
	</npc>
</list>