<?xml version="1.0" encoding="UTF-8"?>
<list xmlns:xsi="http://www.w3.org/2001/XMLSchema-instance" xsi:noNamespaceSchemaLocation="../../../xsd/npcs.xsd">
	<npc id="70012" displayId="31226" name="Manager" usingServerSideName="true" title="CtF Event" usingServerSideTitle="true" type="Folk">
		<race>HUMAN</race>
		<sex>MALE</sex>
		<stats>
			<vitals hp="2444.46819" hpRegen="7.5" mp="1345.8" mpRegen="2.7" />
			<attack physical="688.86373" magical="470.40463" random="30" critical="4" accuracy="95" attackSpeed="253" type="SWORD" range="40" distance="80" width="120" />
			<defence physical="295.91597" magical="216.53847" />
			<speed>
				<walk ground="40" />
				<run ground="120" />
			</speed>
		</stats>
		<status attackable="false" />
		<collision>
			<radius normal="8" />
			<height normal="23" />
		</collision>
	</npc>
	<npc id="82016" displayId="35062" name="Blue" usingServerSideName="true" title="" usingServerSideTitle="true" type="Folk">
		<race>ETC</race>
		<sex>ETC</sex>
		<stats>
			<vitals hp="2444.46819" hpRegen="7.5" mp="1345.8" mpRegen="2.7" />
			<attack physical="688.86373" magical="470.40463" random="30" critical="4" accuracy="95" attackSpeed="253" type="SWORD" range="40" distance="80" width="120" />
			<defence physical="295.91597" magical="216.53847" />
			<speed>
				<walk ground="40" />
				<run ground="120" />
			</speed>
		</stats>
		
		<status attackable="false" showName="true" canMove="false" />
		<collision>
			<radius normal="10" />
			<height normal="80" />
		</collision>
	</npc>
	<npc id="82017" displayId="35062" name="Red" usingServerSideName="true" title="" usingServerSideTitle="true" type="Folk">
		<race>ETC</race>
		<sex>ETC</sex>
		<stats>
			<vitals hp="2444.46819" hpRegen="7.5" mp="1345.8" mpRegen="2.7" />
			<attack physical="688.86373" magical="470.40463" random="30" critical="4" accuracy="95" attackSpeed="253" type="SWORD" range="40" distance="80" width="120" />
			<defence physical="295.91597" magical="216.53847" />
			<speed>
				<walk ground="40" />
				<run ground="120" />
			</speed>
		</stats>
		<status attackable="false" showName="true" canMove="false" />
		<collision>
			<radius normal="10" />
			<height normal="80" />
		</collision>
	</npc>
	<npc id="82018" displayId="31226" name="Manager" usingServerSideName="true" title="CtF Manager" usingServerSideTitle="false" type="Folk">
		<race>ETC</race>
		<sex>ETC</sex>
		<stats>
			<vitals hp="2444.46819" hpRegen="7.5" mp="1345.8" mpRegen="2.7" />
			<attack physical="688.86373" magical="470.40463" random="30" critical="4" accuracy="95" attackSpeed="253" type="SWORD" range="40" distance="80" width="120" />
			<defence physical="295.91597" magical="216.53847" />
			<speed>
				<walk ground="40" />
				<run ground="120" />
			</speed>
		</stats>
		<status attackable="false" showName="false" targetable="false" />
		<collision>
			<radius normal="30" />
			<height normal="31" />
		</collision>
	</npc>
</list>